 create table customers(
  2     cname varchar2(15) primary key,
  3      city varchar2(15),
  4      bname varchar2(15));

Table created.

SQL> create table deposit(
  2     actno varchar2(5) primary key,
  3     cname varchar2(15),
  4     bname varchar2(15),
  5     amount number(9,2),
  6     adate date);

Table created.

SQL> create table branch(
  2     bname varchar2(15),
  3     city varchar2(15));

Table created.

SQL> create table borrow(
  2     loanno varchar2(5),
  3     cname varchar2(15),
  4     bname varchar2(15),
  5     amount number(9,2));

Table created.

SQL> insert into deposit values('&actno','&cname','&bname',&amount,'&adate');
Enter value for actno: 100
Enter value for cname: ANIL
Enter value for bname: VRCE
Enter value for amount: 1000.00
Enter value for adate: 01-MAR-95
old   1: insert into deposit values('&actno','&cname','&bname',&amount,'&adate')
new   1: insert into deposit values('100','ANIL','VRCE',1000.00,'01-MAR-95')

1 row created.

SQL> insert into deposit values('&actno','&cname','&bname',&amount,'&adate');
Enter value for actno: 101
Enter value for cname: SUNIL
Enter value for bname: AJNI
Enter value for amount: 5000.00
Enter value for adate: 04-JAN-96
old   1: insert into deposit values('&actno','&cname','&bname',&amount,'&adate')
new   1: insert into deposit values('101','SUNIL','AJNI',5000.00,'04-JAN-96')

1 row created.

SQL> insert into deposit values('&actno','&cname','&bname',&amount,'&adate');
Enter value for actno: 102
Enter value for cname: MEHUL
Enter value for bname: KAROLBAGH
Enter value for amount: 3500.00
Enter value for adate: 17-NOV-95
old   1: insert into deposit values('&actno','&cname','&bname',&amount,'&adate')
new   1: insert into deposit values('102','MEHUL','KAROLBAGH',3500.00,'17-NOV-95')

1 row created.

SQL> insert into deposit values('&actno','&cname','&bname',&amount,'&adate');
Enter value for actno: 104
Enter value for cname: MADHURI
Enter value for bname: CHANDI
Enter value for amount: 1200.00
Enter value for adate: 17-DEC-95
old   1: insert into deposit values('&actno','&cname','&bname',&amount,'&adate')
new   1: insert into deposit values('104','MADHURI','CHANDI',1200.00,'17-DEC-95')

1 row created.

SQL> insert into deposit values('&actno','&cname','&bname',&amount,'&adate');
Enter value for actno: 105
Enter value for cname: PRMOD
Enter value for bname: M G ROAD
Enter value for amount: 3000.00
Enter value for adate: 27-MAR-96
old   1: insert into deposit values('&actno','&cname','&bname',&amount,'&adate')
new   1: insert into deposit values('105','PRMOD','M G ROAD',3000.00,'27-MAR-96')

1 row created.

SQL> insert into deposit values('&actno','&cname','&bname',&amount,'&adate');
Enter value for actno: 106
Enter value for cname: SANDIP
Enter value for bname: ANDHERI
Enter value for amount: 2000.00
Enter value for adate: 31-MAR-96
old   1: insert into deposit values('&actno','&cname','&bname',&amount,'&adate')
new   1: insert into deposit values('106','SANDIP','ANDHERI',2000.00,'31-MAR-96')

1 row created.

SQL> insert into deposit values('&actno','&cname','&bname',&amount,'&adate');
Enter value for actno: 107
Enter value for cname: SHIVANI
Enter value for bname: VIRAR
Enter value for amount: 1000.00
Enter value for adate: 05-SEP-95
old   1: insert into deposit values('&actno','&cname','&bname',&amount,'&adate')
new   1: insert into deposit values('107','SHIVANI','VIRAR',1000.00,'05-SEP-95')

1 row created.

SQL> insert into deposit values('&actno','&cname','&bname',&amount,'&adate');
Enter value for actno: 108
Enter value for cname: KRANTI
Enter value for bname: NEHRU PLACE
Enter value for amount: 5000.00
Enter value for adate: 02-JUL-95
old   1: insert into deposit values('&actno','&cname','&bname',&amount,'&adate')
new   1: insert into deposit values('108','KRANTI','NEHRU PLACE',5000.00,'02-JUL-95')

1 row created.

SQL> insert into deposit values('&actno','&cname','&bname',&amount,'&adate');
Enter value for actno: 109
Enter value for cname: MINU
Enter value for bname: POWAI
Enter value for amount: 7000.00
Enter value for adate: 10-AUG-95
old   1: insert into deposit values('&actno','&cname','&bname',&amount,'&adate')
new   1: insert into deposit values('109','MINU','POWAI',7000.00,'10-AUG-95')

1 row created.

SQL>  INSERT INTO BRANCH VALUES('&BNAME','&CITY');
Enter value for bname: VRCE
Enter value for city: NAGPUR
old   1:  INSERT INTO BRANCH VALUES('&BNAME','&CITY')
new   1:  INSERT INTO BRANCH VALUES('VRCE','NAGPUR')

1 row created.

SQL>  INSERT INTO BRANCH VALUES('&BNAME','&CITY');
Enter value for bname: AJNI
Enter value for city: NAGPUR
old   1:  INSERT INTO BRANCH VALUES('&BNAME','&CITY')
new   1:  INSERT INTO BRANCH VALUES('AJNI','NAGPUR')

1 row created.

SQL>  INSERT INTO BRANCH VALUES('&BNAME','&CITY');
Enter value for bname: KAROLBAGH
Enter value for city: DELHI
old   1:  INSERT INTO BRANCH VALUES('&BNAME','&CITY')
new   1:  INSERT INTO BRANCH VALUES('KAROLBAGH','DELHI')

1 row created.

SQL>  INSERT INTO BRANCH VALUES('&BNAME','&CITY');
Enter value for bname: CHANDI
Enter value for city: DELHI
old   1:  INSERT INTO BRANCH VALUES('&BNAME','&CITY')
new   1:  INSERT INTO BRANCH VALUES('CHANDI','DELHI')

1 row created.

SQL>  INSERT INTO BRANCH VALUES('&BNAME','&CITY');
Enter value for bname: DHARAMPETH
Enter value for city: NAGPUR
old   1:  INSERT INTO BRANCH VALUES('&BNAME','&CITY')
new   1:  INSERT INTO BRANCH VALUES('DHARAMPETH','NAGPUR')

1 row created.

SQL>  INSERT INTO BRANCH VALUES('&BNAME','&CITY');M G ROAD
  2
SQL>  INSERT INTO BRANCH VALUES('&BNAME','&CITY');M G ROAD
  2
SQL>  INSERT INTO BRANCH VALUES('&BNAME','&CITY');
Enter value for bname: M G ROAD
Enter value for city: BANGLORE
old   1:  INSERT INTO BRANCH VALUES('&BNAME','&CITY')
new   1:  INSERT INTO BRANCH VALUES('M G ROAD','BANGLORE')

1 row created.

SQL>  INSERT INTO BRANCH VALUES('&BNAME','&CITY');
Enter value for bname: ANDHERI
Enter value for city: BOMBAY
old   1:  INSERT INTO BRANCH VALUES('&BNAME','&CITY')
new   1:  INSERT INTO BRANCH VALUES('ANDHERI','BOMBAY')

1 row created.

SQL>  INSERT INTO BRANCH VALUES('&BNAME','&CITY');
Enter value for bname: VIRAR
Enter value for city: BOMBAY
old   1:  INSERT INTO BRANCH VALUES('&BNAME','&CITY')
new   1:  INSERT INTO BRANCH VALUES('VIRAR','BOMBAY')

1 row created.

SQL>  INSERT INTO BRANCH VALUES('&BNAME','&CITY');
Enter value for bname: NEHRU PLACE
Enter value for city: DELHI
old   1:  INSERT INTO BRANCH VALUES('&BNAME','&CITY')
new   1:  INSERT INTO BRANCH VALUES('NEHRU PLACE','DELHI')

1 row created.

SQL>  INSERT INTO BRANCH VALUES('&BNAME','&CITY');
Enter value for bname: POWAI
Enter value for city: BOMBAY
old   1:  INSERT INTO BRANCH VALUES('&BNAME','&CITY')
new   1:  INSERT INTO BRANCH VALUES('POWAI','BOMBAY')

1 row created.

SQL>  INSERT INTO CUSTOMERS VALUES('&CNAME','&CITY');
Enter value for cname: ANIL
Enter value for city: CALCUTTA
old   1:  INSERT INTO CUSTOMERS VALUES('&CNAME','&CITY')
new   1:  INSERT INTO CUSTOMERS VALUES('ANIL','CALCUTTA')
 INSERT INTO CUSTOMERS VALUES('ANIL','CALCUTTA')
             *
ERROR at line 1:
ORA-00947: not enough values


SQL> DROP TABLE CUSTOMERS;

Table dropped.

SQL> create table customers(
  2     cname varchar2(15) primary key,
  3      city varchar2(15));

Table created.

SQL>  INSERT INTO CUSTOMERS VALUES('&CNAME','&CITY');
Enter value for cname: ANIL
Enter value for city: CALCUTTA
old   1:  INSERT INTO CUSTOMERS VALUES('&CNAME','&CITY')
new   1:  INSERT INTO CUSTOMERS VALUES('ANIL','CALCUTTA')

1 row created.

SQL>  INSERT INTO CUSTOMERS VALUES('&CNAME','&CITY');
Enter value for cname: SUNIL
Enter value for city: DELHI
old   1:  INSERT INTO CUSTOMERS VALUES('&CNAME','&CITY')
new   1:  INSERT INTO CUSTOMERS VALUES('SUNIL','DELHI')

1 row created.

SQL>  INSERT INTO CUSTOMERS VALUES('&CNAME','&CITY');
Enter value for cname: MEHUL
Enter value for city: BARODA
old   1:  INSERT INTO CUSTOMERS VALUES('&CNAME','&CITY')
new   1:  INSERT INTO CUSTOMERS VALUES('MEHUL','BARODA')

1 row created.

SQL>  INSERT INTO CUSTOMERS VALUES('&CNAME','&CITY');
Enter value for cname: MANDAR
Enter value for city: PATNA
old   1:  INSERT INTO CUSTOMERS VALUES('&CNAME','&CITY')
new   1:  INSERT INTO CUSTOMERS VALUES('MANDAR','PATNA')

1 row created.

SQL>  INSERT INTO CUSTOMERS VALUES('&CNAME','&CITY');
Enter value for cname: MADHURI
Enter value for city: NAGPUR
old   1:  INSERT INTO CUSTOMERS VALUES('&CNAME','&CITY')
new   1:  INSERT INTO CUSTOMERS VALUES('MADHURI','NAGPUR')

1 row created.

SQL>  INSERT INTO CUSTOMERS VALUES('&CNAME','&CITY');
Enter value for cname: PRAMOD
Enter value for city: NAGPUR
old   1:  INSERT INTO CUSTOMERS VALUES('&CNAME','&CITY')
new   1:  INSERT INTO CUSTOMERS VALUES('PRAMOD','NAGPUR')

1 row created.

SQL>  INSERT INTO CUSTOMERS VALUES('&CNAME','&CITY');
Enter value for cname: SANDIP
Enter value for city: SURAT
old   1:  INSERT INTO CUSTOMERS VALUES('&CNAME','&CITY')
new   1:  INSERT INTO CUSTOMERS VALUES('SANDIP','SURAT')

1 row created.

SQL>  INSERT INTO CUSTOMERS VALUES('&CNAME','&CITY');
Enter value for cname: SHIVANI
Enter value for city: BOMBAY
old   1:  INSERT INTO CUSTOMERS VALUES('&CNAME','&CITY')
new   1:  INSERT INTO CUSTOMERS VALUES('SHIVANI','BOMBAY')

1 row created.

SQL>  INSERT INTO CUSTOMERS VALUES('&CNAME','&CITY');
Enter value for cname: KRANTI
Enter value for city: NAREN
old   1:  INSERT INTO CUSTOMERS VALUES('&CNAME','&CITY')
new   1:  INSERT INTO CUSTOMERS VALUES('KRANTI','NAREN')

1 row created.

SQL>  INSERT INTO CUSTOMERS VALUES('&CNAME','&CITY');
Enter value for cname: NAREN
Enter value for city: BOMBAY
old   1:  INSERT INTO CUSTOMERS VALUES('&CNAME','&CITY')
new   1:  INSERT INTO CUSTOMERS VALUES('NAREN','BOMBAY')

1 row created.

SQL> UPDATE CUSTOMERS SET CITY="BOMBAY" WHERE CNAME="KRANTI";
UPDATE CUSTOMERS SET CITY="BOMBAY" WHERE CNAME="KRANTI"
                                               *
ERROR at line 1:
ORA-00904: "KRANTI": invalid identifier


SQL> UPDATE CUSTOMERS SET CITY='BOMBAY' WHERE CNAME='KRANTI';

1 row updated.

SQL> SELECT * FROM CUSTOMERS;

CNAME           CITY
--------------- ---------------
ANIL            CALCUTTA
SUNIL           DELHI
MEHUL           BARODA
MANDAR          PATNA
MADHURI         NAGPUR
PRAMOD          NAGPUR
SANDIP          SURAT
SHIVANI         BOMBAY
KRANTI          BOMBAY
NAREN           BOMBAY

10 rows selected.

SQL> SELECT * FROM DEPOSIT;

ACTNO CNAME           BNAME               AMOUNT ADATE
----- --------------- --------------- ---------- ---------
100   ANIL            VRCE                  1000 01-MAR-95
101   SUNIL           AJNI                  5000 04-JAN-96
102   MEHUL           KAROLBAGH             3500 17-NOV-95
104   MADHURI         CHANDI                1200 17-DEC-95
105   PRMOD           M G ROAD              3000 27-MAR-96
106   SANDIP          ANDHERI               2000 31-MAR-96
107   SHIVANI         VIRAR                 1000 05-SEP-95
108   KRANTI          NEHRU PLACE           5000 02-JUL-95
109   MINU            POWAI                 7000 10-AUG-95

9 rows selected.

SQL> SELECT * FROM BRANCH;

BNAME           CITY
--------------- ---------------
VRCE            NAGPUR
AJNI            NAGPUR
KAROLBAGH       DELHI
CHANDI          DELHI
DHARAMPETH      NAGPUR
M G ROAD        BANGLORE
ANDHERI         BOMBAY
VIRAR           BOMBAY
NEHRU PLACE     DELHI
POWAI           BOMBAY

10 rows selected.

SQL>  INSERT INTO BORROW VALUES('&LOANNO','&CNAME','&BNAME',&AMOUNT);
Enter value for loanno: 201
Enter value for cname: ANILVRCE
Enter value for bname:
Enter value for amount:
old   1:  INSERT INTO BORROW VALUES('&LOANNO','&CNAME','&BNAME',&AMOUNT)
new   1:  INSERT INTO BORROW VALUES('201','ANILVRCE','',)
 INSERT INTO BORROW VALUES('201','ANILVRCE','',)
                                               *
ERROR at line 1:
ORA-00936: missing expression


SQL>  INSERT INTO BORROW VALUES('&LOANNO','&CNAME','&BNAME',&AMOUNT);
Enter value for loanno: 201
Enter value for cname: ANIL
Enter value for bname: VRCE
Enter value for amount: 1000.00
old   1:  INSERT INTO BORROW VALUES('&LOANNO','&CNAME','&BNAME',&AMOUNT)
new   1:  INSERT INTO BORROW VALUES('201','ANIL','VRCE',1000.00)

1 row created.

SQL>  INSERT INTO BORROW VALUES('&LOANNO','&CNAME','&BNAME',&AMOUNT);
Enter value for loanno: 206
Enter value for cname: MEHUL
Enter value for bname: AJNI
Enter value for amount: 5000.00
old   1:  INSERT INTO BORROW VALUES('&LOANNO','&CNAME','&BNAME',&AMOUNT)
new   1:  INSERT INTO BORROW VALUES('206','MEHUL','AJNI',5000.00)

1 row created.

SQL>  INSERT INTO BORROW VALUES('&LOANNO','&CNAME','&BNAME',&AMOUNT);
Enter value for loanno: 311
Enter value for cname: SUNIL
Enter value for bname: DHARAMPETH
Enter value for amount: 3000.00
old   1:  INSERT INTO BORROW VALUES('&LOANNO','&CNAME','&BNAME',&AMOUNT)
new   1:  INSERT INTO BORROW VALUES('311','SUNIL','DHARAMPETH',3000.00)

1 row created.

SQL>  INSERT INTO BORROW VALUES('&LOANNO','&CNAME','&BNAME',&AMOUNT);
Enter value for loanno: 321
Enter value for cname: MADHURI
Enter value for bname: ANDHERI
Enter value for amount: 2000.00
old   1:  INSERT INTO BORROW VALUES('&LOANNO','&CNAME','&BNAME',&AMOUNT)
new   1:  INSERT INTO BORROW VALUES('321','MADHURI','ANDHERI',2000.00)

1 row created.

SQL>  INSERT INTO BORROW VALUES('&LOANNO','&CNAME','&BNAME',&AMOUNT);
Enter value for loanno: 375
Enter value for cname: PRMOD
Enter value for bname: VIRAR
Enter value for amount: 8000.00
old   1:  INSERT INTO BORROW VALUES('&LOANNO','&CNAME','&BNAME',&AMOUNT)
new   1:  INSERT INTO BORROW VALUES('375','PRMOD','VIRAR',8000.00)

1 row created.

SQL>  INSERT INTO BORROW VALUES('&LOANNO','&CNAME','&BNAME',&AMOUNT);
Enter value for loanno: 481
Enter value for cname: KRANTI
Enter value for bname: NEHRU
Enter value for amount: 3000.00
old   1:  INSERT INTO BORROW VALUES('&LOANNO','&CNAME','&BNAME',&AMOUNT)
new   1:  INSERT INTO BORROW VALUES('481','KRANTI','NEHRU',3000.00)

1 row created.

SQL> UPDATE BORROW SET BNAME='NEHRU PLACE' WHERE CNAME='KRANTI';

1 row updated.

SQL>  INSERT INTO BORROW VALUES('&LOANNO','&CNAME','&BNAME',&AMOUNT);
Enter value for loanno: 201
Enter value for cname: ANIL
Enter value for bname: VRCE
Enter value for amount: 1000.00
old   1:  INSERT INTO BORROW VALUES('&LOANNO','&CNAME','&BNAME',&AMOUNT)
new   1:  INSERT INTO BORROW VALUES('201','ANIL','VRCE',1000.00)

1 row created.

SQL>  INSERT INTO BORROW VALUES('&LOANNO','&CNAME','&BNAME',&AMOUNT);
Enter value for loanno: 206
Enter value for cname: MEHUL
Enter value for bname: AJNI
Enter value for amount: 5000.00
old   1:  INSERT INTO BORROW VALUES('&LOANNO','&CNAME','&BNAME',&AMOUNT)
new   1:  INSERT INTO BORROW VALUES('206','MEHUL','AJNI',5000.00)

1 row created.

SQL>  INSERT INTO BORROW VALUES('&LOANNO','&CNAME','&BNAME',&AMOUNT);
Enter value for loanno: 311
Enter value for cname: SUNIL
Enter value for bname: DHARAMPETH
Enter value for amount: 3000.00
old   1:  INSERT INTO BORROW VALUES('&LOANNO','&CNAME','&BNAME',&AMOUNT)
new   1:  INSERT INTO BORROW VALUES('311','SUNIL','DHARAMPETH',3000.00)

1 row created.

SQL>  INSERT INTO BORROW VALUES('&LOANNO','&CNAME','&BNAME',&AMOUNT);
Enter value for loanno: 321
Enter value for cname: MADHURI
Enter value for bname: ANDHERI
Enter value for amount: 2000.00
old   1:  INSERT INTO BORROW VALUES('&LOANNO','&CNAME','&BNAME',&AMOUNT)
new   1:  INSERT INTO BORROW VALUES('321','MADHURI','ANDHERI',2000.00)

1 row created.

SQL> SELECT * FROM BORROW;

LOANN CNAME           BNAME               AMOUNT
----- --------------- --------------- ----------
201   ANIL            VRCE                  1000
206   MEHUL           AJNI                  5000
311   SUNIL           DHARAMPETH            3000
321   MADHURI         ANDHERI               2000
375   PRMOD           VIRAR                 8000
481   KRANTI          NEHRU PLACE           3000
201   ANIL            VRCE                  1000
206   MEHUL           AJNI                  5000
311   SUNIL           DHARAMPETH            3000
321   MADHURI         ANDHERI               2000

10 rows selected.