SQL> create table Bank_branch
  2  (branch_id char(6),
  3  branch_name varchar2(10),
  4  branch_address varchar2(15),
  5  branch_city varchar2(10),
  6  branch_state varchar2(10),
  7  branch_open_date date);

Table created.

SQL> insert into bank_branch values('&branch_name',
  2  '&branch_id','&branch_address',
  3  '&branch_city','&branch_state','branch_open_date');
Enter value for branch_name: BOI
old   1: insert into bank_branch values('&branch_name',
new   1: insert into bank_branch values('BOI',
Enter value for branch_id: B001
Enter value for branch_address: JAGNATH ROAD
old   2: '&branch_id','&branch_address',
new   2: 'B001','JAGNATH ROAD',
Enter value for branch_city: RAJKOT
Enter value for branch_state: GUJARAT
old   3: '&branch_city','&branch_state','branch_open_date')
new   3: 'RAJKOT','GUJARAT','branch_open_date')
'RAJKOT','GUJARAT','branch_open_date')
                   *
ERROR at line 3:
ORA-01858: a non-numeric character was found where a numeric was expected 


SQL> insert into bank_branch values('&branch_ID','&branch_name','&branch_address','&branch_city','&branch_state','branch_open_date');
Enter value for branch_id: B001
Enter value for branch_name: BOI
Enter value for branch_address: JAGNATH ROAD
Enter value for branch_city: RAJKOT
Enter value for branch_state: GUJARAT
old   1: insert into bank_branch values('&branch_ID','&branch_name','&branch_address','&branch_city','&branch_state','branch_open_date')
new   1: insert into bank_branch values('B001','BOI','JAGNATH ROAD','RAJKOT','GUJARAT','branch_open_date')
insert into bank_branch values('B001','BOI','JAGNATH ROAD','RAJKOT','GUJARAT','branch_open_date')
                                                                              *
ERROR at line 1:
ORA-01858: a non-numeric character was found where a numeric was expected 


SQL> insert into bank_branch values('&branch_ID','&branch_name','&branch_address','&branch_city','&branch_state','&branch_open_date');
Enter value for branch_id: B001
Enter value for branch_name: BOI
Enter value for branch_address: JAGNATH ROAD
Enter value for branch_city: RAJKOT
Enter value for branch_state: GUJARAT
Enter value for branch_open_date: 22-MAR-2015
old   1: insert into bank_branch values('&branch_ID','&branch_name','&branch_address','&branch_city','&branch_state','&branch_open_date')
new   1: insert into bank_branch values('B001','BOI','JAGNATH ROAD','RAJKOT','GUJARAT','22-MAR-2015')

1 row created.

SQL> insert into bank_branch values('&branch_ID','&branch_name','&branch_address','&branch_city','&branch_state','&branch_open_date');
Enter value for branch_id: B002
Enter value for branch_name: SBI
Enter value for branch_address: BORIWALI ROAD
Enter value for branch_city: MUMBAI
Enter value for branch_state: MAHARASHTRA
Enter value for branch_open_date: 12-JAN-2000
old   1: insert into bank_branch values('&branch_ID','&branch_name','&branch_address','&branch_city','&branch_state','&branch_open_date')
new   1: insert into bank_branch values('B002','SBI','BORIWALI ROAD','MUMBAI','MAHARASHTRA','12-JAN-2000')
insert into bank_branch values('B002','SBI','BORIWALI ROAD','MUMBAI','MAHARASHTRA','12-JAN-2000')
                                                                     *
ERROR at line 1:
ORA-12899: value too large for column "AAYUSHI"."BANK_BRANCH"."BRANCH_STATE" (actual: 11, maximum: 10) 


SQL> ALTER TABLE BANK_BRANCH MODIFY BRANCH_STATE VARCHAR2(20);

Table altered.

SQL> insert into bank_branch values('&branch_ID','&branch_name','&branch_address','&branch_city','&branch_state','&branch_open_date');
Enter value for branch_id: B002
Enter value for branch_name: SBI
Enter value for branch_address: BORIWALI ROAD
Enter value for branch_city: MUMBAI
Enter value for branch_state: MAHARASHTRA
Enter value for branch_open_date: 12-JAN-2000
old   1: insert into bank_branch values('&branch_ID','&branch_name','&branch_address','&branch_city','&branch_state','&branch_open_date')
new   1: insert into bank_branch values('B002','SBI','BORIWALI ROAD','MUMBAI','MAHARASHTRA','12-JAN-2000')

1 row created.

SQL> insert into bank_branch values('&branch_ID','&branch_name','&branch_address','&branch_city','&branch_state','&branch_open_date');
Enter value for branch_id: B003
Enter value for branch_name: HDFC
Enter value for branch_address: AGRA ROAD
Enter value for branch_city: AGRA
Enter value for branch_state: U.P
Enter value for branch_open_date: 04-FEB-1998
old   1: insert into bank_branch values('&branch_ID','&branch_name','&branch_address','&branch_city','&branch_state','&branch_open_date')
new   1: insert into bank_branch values('B003','HDFC','AGRA ROAD','AGRA','U.P','04-FEB-1998')

1 row created.

SQL> insert into bank_branch values('&branch_ID','&branch_name','&branch_address','&branch_city','&branch_state','&branch_open_date');
Enter value for branch_id: B004
Enter value for branch_name: DENA BANK
Enter value for branch_address: C G ROAD
Enter value for branch_city: AHEMDABAD
Enter value for branch_state: GUJARAT
Enter value for branch_open_date: 20-SEP-2012
old   1: insert into bank_branch values('&branch_ID','&branch_name','&branch_address','&branch_city','&branch_state','&branch_open_date')
new   1: insert into bank_branch values('B004','DENA BANK','C G ROAD','AHEMDABAD','GUJARAT','20-SEP-2012')

1 row created.

SQL> insert into bank_branch values('&branch_ID','&branch_name','&branch_address','&branch_city','&branch_state','&branch_open_date');
Enter value for branch_id: B005
Enter value for branch_name: ICICI
Enter value for branch_address: MAJAVADI ROAD
Enter value for branch_city: JUNAGADH
Enter value for branch_state: GUJARAT
Enter value for branch_open_date: 07-MAY-2011
old   1: insert into bank_branch values('&branch_ID','&branch_name','&branch_address','&branch_city','&branch_state','&branch_open_date')
new   1: insert into bank_branch values('B005','ICICI','MAJAVADI ROAD','JUNAGADH','GUJARAT','07-MAY-2011')

1 row created.

SQL> SELECT * FROM BANK_BRANCH;

BRANCH BRANCH_NAM BRANCH_ADDRESS  BRANCH_CIT BRANCH_STATE         BRANCH_OP                                                                                                                                                                                                                                                                                                                                                                                                                                                                                                                                             
------ ---------- --------------- ---------- -------------------- ---------                                                                                                                                                                                                                                                                                                                                                                                                                                                                                                                                             
B001   BOI        JAGNATH ROAD    RAJKOT     GUJARAT              22-MAR-15                                                                                                                                                                                                                                                                                                                                                                                                                                                                                                                                             
B002   SBI        BORIWALI ROAD   MUMBAI     MAHARASHTRA          12-JAN-00                                                                                                                                                                                                                                                                                                                                                                                                                                                                                                                                             
B003   HDFC       AGRA ROAD       AGRA       U.P                  04-FEB-98                                                                                                                                                                                                                                                                                                                                                                                                                                                                                                                                             
B004   DENA BANK  C G ROAD        AHEMDABAD  GUJARAT              20-SEP-12                                                                                                                                                                                                                                                                                                                                                                                                                                                                                                                                             
B005   ICICI      MAJAVADI ROAD   JUNAGADH   GUJARAT              07-MAY-11                                                                                                                                                                                                                                                                                                                                                                                                                                                                                                                                             

SQL> SELECT BRANCH_ID FROM BANK_BRANCH;

BRANCH                                                                                                                                                                                                                                                                                                                                                                                                                                                                                                                                                                                                                  
------                                                                                                                                                                                                                                                                                                                                                                                                                                                                                                                                                                                                                  
B001                                                                                                                                                                                                                                                                                                                                                                                                                                                                                                                                                                                                                    
B002                                                                                                                                                                                                                                                                                                                                                                                                                                                                                                                                                                                                                    
B003                                                                                                                                                                                                                                                                                                                                                                                                                                                                                                                                                                                                                    
B004                                                                                                                                                                                                                                                                                                                                                                                                                                                                                                                                                                                                                    
B005                                                                                                                                                                                                                                                                                                                                                                                                                                                                                                                                                                                                                    

SQL> SELECT BRANCH_ID,BRANCH_ADDRESS FROM BANK_BRANCH;

BRANCH BRANCH_ADDRESS                                                                                                                                                                                                                                                                                                                                                                                                                                                                                                                                                                                                   
------ ---------------                                                                                                                                                                                                                                                                                                                                                                                                                                                                                                                                                                                                  
B001   JAGNATH ROAD                                                                                                                                                                                                                                                                                                                                                                                                                                                                                                                                                                                                     
B002   BORIWALI ROAD                                                                                                                                                                                                                                                                                                                                                                                                                                                                                                                                                                                                    
B003   AGRA ROAD                                                                                                                                                                                                                                                                                                                                                                                                                                                                                                                                                                                                        
B004   C G ROAD                                                                                                                                                                                                                                                                                                                                                                                                                                                                                                                                                                                                         
B005   MAJAVADI ROAD                                                                                                                                                                                                                                                                                                                                                                                                                                                                                                                                                                                                    

SQL> SELECT BRANCH_NAME,BRANCH_ADDRESS,BRANCH_CITY FROM BANK_BRANCH;

BRANCH_NAM BRANCH_ADDRESS  BRANCH_CIT                                                                                                                                                                                                                                                                                                                                                                                                                                                                                                                                                                                   
---------- --------------- ----------                                                                                                                                                                                                                                                                                                                                                                                                                                                                                                                                                                                   
BOI        JAGNATH ROAD    RAJKOT                                                                                                                                                                                                                                                                                                                                                                                                                                                                                                                                                                                       
SBI        BORIWALI ROAD   MUMBAI                                                                                                                                                                                                                                                                                                                                                                                                                                                                                                                                                                                       
HDFC       AGRA ROAD       AGRA                                                                                                                                                                                                                                                                                                                                                                                                                                                                                                                                                                                         
DENA BANK  C G ROAD        AHEMDABAD                                                                                                                                                                                                                                                                                                                                                                                                                                                                                                                                                                                    
ICICI      MAJAVADI ROAD   JUNAGADH                                                                                                                                                                                                                                                                                                                                                                                                                                                                                                                                                                                     

SQL> SELECT BRANCH_CITY,BRANCH_STATE,BRANCH_OPEN_DATE FROM BANK_BRANCH;

BRANCH_CIT BRANCH_STATE         BRANCH_OP                                                                                                                                                                                                                                                                                                                                                                                                                                                                                                                                                                               
---------- -------------------- ---------                                                                                                                                                                                                                                                                                                                                                                                                                                                                                                                                                                               
RAJKOT     GUJARAT              22-MAR-15                                                                                                                                                                                                                                                                                                                                                                                                                                                                                                                                                                               
MUMBAI     MAHARASHTRA          12-JAN-00                                                                                                                                                                                                                                                                                                                                                                                                                                                                                                                                                                               
AGRA       U.P                  04-FEB-98                                                                                                                                                                                                                                                                                                                                                                                                                                                                                                                                                                               
AHEMDABAD  GUJARAT              20-SEP-12                                                                                                                                                                                                                                                                                                                                                                                                                                                                                                                                                                               
JUNAGADH   GUJARAT              07-MAY-11                                                                                                                                                                                                                                                                                                                                                                                                                                                                                                                                                                               

SQL> SELECT * FROM BANK_BRANCH ORDERBY BRANCH_ID;
SELECT * FROM BANK_BRANCH ORDERBY BRANCH_ID
                                  *
ERROR at line 1:
ORA-00933: SQL command not properly ended 


SQL> SELECT * FROM BANK_BRANCH ORDER BY BRANCH_ID;

BRANCH BRANCH_NAM BRANCH_ADDRESS  BRANCH_CIT BRANCH_STATE         BRANCH_OP                                                                                                                                                                                                                                                                                                                                                                                                                                                                                                                                             
------ ---------- --------------- ---------- -------------------- ---------                                                                                                                                                                                                                                                                                                                                                                                                                                                                                                                                             
B001   BOI        JAGNATH ROAD    RAJKOT     GUJARAT              22-MAR-15                                                                                                                                                                                                                                                                                                                                                                                                                                                                                                                                             
B002   SBI        BORIWALI ROAD   MUMBAI     MAHARASHTRA          12-JAN-00                                                                                                                                                                                                                                                                                                                                                                                                                                                                                                                                             
B003   HDFC       AGRA ROAD       AGRA       U.P                  04-FEB-98                                                                                                                                                                                                                                                                                                                                                                                                                                                                                                                                             
B004   DENA BANK  C G ROAD        AHEMDABAD  GUJARAT              20-SEP-12                                                                                                                                                                                                                                                                                                                                                                                                                                                                                                                                             
B005   ICICI      MAJAVADI ROAD   JUNAGADH   GUJARAT              07-MAY-11                                                                                                                                                                                                                                                                                                                                                                                                                                                                                                                                             

SQL> SELECT * FROM BANK_BRANCH ORDER BY BRANCH_NAME;

BRANCH BRANCH_NAM BRANCH_ADDRESS  BRANCH_CIT BRANCH_STATE         BRANCH_OP                                                                                                                                                                                                                                                                                                                                                                                                                                                                                                                                             
------ ---------- --------------- ---------- -------------------- ---------                                                                                                                                                                                                                                                                                                                                                                                                                                                                                                                                             
B001   BOI        JAGNATH ROAD    RAJKOT     GUJARAT              22-MAR-15                                                                                                                                                                                                                                                                                                                                                                                                                                                                                                                                             
B004   DENA BANK  C G ROAD        AHEMDABAD  GUJARAT              20-SEP-12                                                                                                                                                                                                                                                                                                                                                                                                                                                                                                                                             
B003   HDFC       AGRA ROAD       AGRA       U.P                  04-FEB-98                                                                                                                                                                                                                                                                                                                                                                                                                                                                                                                                             
B005   ICICI      MAJAVADI ROAD   JUNAGADH   GUJARAT              07-MAY-11                                                                                                                                                                                                                                                                                                                                                                                                                                                                                                                                             
B002   SBI        BORIWALI ROAD   MUMBAI     MAHARASHTRA          12-JAN-00                                                                                                                                                                                                                                                                                                                                                                                                                                                                                                                                             

SQL> SELECT * FROM BANK_BRANCH ORDER BY BRANCH_CITY;

BRANCH BRANCH_NAM BRANCH_ADDRESS  BRANCH_CIT BRANCH_STATE         BRANCH_OP                                                                                                                                                                                                                                                                                                                                                                                                                                                                                                                                             
------ ---------- --------------- ---------- -------------------- ---------                                                                                                                                                                                                                                                                                                                                                                                                                                                                                                                                             
B003   HDFC       AGRA ROAD       AGRA       U.P                  04-FEB-98                                                                                                                                                                                                                                                                                                                                                                                                                                                                                                                                             
B004   DENA BANK  C G ROAD        AHEMDABAD  GUJARAT              20-SEP-12                                                                                                                                                                                                                                                                                                                                                                                                                                                                                                                                             
B005   ICICI      MAJAVADI ROAD   JUNAGADH   GUJARAT              07-MAY-11                                                                                                                                                                                                                                                                                                                                                                                                                                                                                                                                             
B002   SBI        BORIWALI ROAD   MUMBAI     MAHARASHTRA          12-JAN-00                                                                                                                                                                                                                                                                                                                                                                                                                                                                                                                                             
B001   BOI        JAGNATH ROAD    RAJKOT     GUJARAT              22-MAR-15                                                                                                                                                                                                                                                                                                                                                                                                                                                                                                                                             

SQL> SELECT * FROM BANK_BRANCH ORDER BY BRANCH_STATE;

BRANCH BRANCH_NAM BRANCH_ADDRESS  BRANCH_CIT BRANCH_STATE         BRANCH_OP                                                                                                                                                                                                                                                                                                                                                                                                                                                                                                                                             
------ ---------- --------------- ---------- -------------------- ---------                                                                                                                                                                                                                                                                                                                                                                                                                                                                                                                                             
B001   BOI        JAGNATH ROAD    RAJKOT     GUJARAT              22-MAR-15                                                                                                                                                                                                                                                                                                                                                                                                                                                                                                                                             
B005   ICICI      MAJAVADI ROAD   JUNAGADH   GUJARAT              07-MAY-11                                                                                                                                                                                                                                                                                                                                                                                                                                                                                                                                             
B004   DENA BANK  C G ROAD        AHEMDABAD  GUJARAT              20-SEP-12                                                                                                                                                                                                                                                                                                                                                                                                                                                                                                                                             
B002   SBI        BORIWALI ROAD   MUMBAI     MAHARASHTRA          12-JAN-00                                                                                                                                                                                                                                                                                                                                                                                                                                                                                                                                             
B003   HDFC       AGRA ROAD       AGRA       U.P                  04-FEB-98                                                                                                                                                                                                                                                                                                                                                                                                                                                                                                                                             

SQL> ALTER TABLE BANK_BRANCH MODIFY BRANCH_STATE VARCHAR2(20);

Table altered.

SQL> DESC BANK_BRANCH;
 Name                                                                                                                                                                                                                                                                                                                                                              Null?    Type
 ----------------------------------------------------------------------------------------------------------------------------------------------------------------------------------------------------------------------------------------------------------------------------------------------------------------------------------------------------------------- -------- --------------------------------------------------------------------------------------------------------------------------------------------------------------------------------------------------------------------------------------------
 BRANCH_ID                                                                                                                                                                                                                                                                                                                                                                  CHAR(6)
 BRANCH_NAME                                                                                                                                                                                                                                                                                                                                                                VARCHAR2(10)
 BRANCH_ADDRESS                                                                                                                                                                                                                                                                                                                                                             VARCHAR2(15)
 BRANCH_CITY                                                                                                                                                                                                                                                                                                                                                                VARCHAR2(10)
 BRANCH_STATE                                                                                                                                                                                                                                                                                                                                                               VARCHAR2(20)
 BRANCH_OPEN_DATE                                                                                                                                                                                                                                                                                                                                                           DATE

SQL> UPDATE BANK_BRANCH SET BRANCH_NAME='UNION' WHERE BRANCH_ID='B003';

1 row updated.

SQL> SELECT * FROM BANK_BRANCH;

BRANCH BRANCH_NAM BRANCH_ADDRESS  BRANCH_CIT BRANCH_STATE         BRANCH_OP                                                                                                                                                                                                                                                                                                                                                                                                                                                                                                                                             
------ ---------- --------------- ---------- -------------------- ---------                                                                                                                                                                                                                                                                                                                                                                                                                                                                                                                                             
B001   BOI        JAGNATH ROAD    RAJKOT     GUJARAT              22-MAR-15                                                                                                                                                                                                                                                                                                                                                                                                                                                                                                                                             
B002   SBI        BORIWALI ROAD   MUMBAI     MAHARASHTRA          12-JAN-00                                                                                                                                                                                                                                                                                                                                                                                                                                                                                                                                             
B003   UNION      AGRA ROAD       AGRA       U.P                  04-FEB-98                                                                                                                                                                                                                                                                                                                                                                                                                                                                                                                                             
B004   DENA BANK  C G ROAD        AHEMDABAD  GUJARAT              20-SEP-12                                                                                                                                                                                                                                                                                                                                                                                                                                                                                                                                             
B005   ICICI      MAJAVADI ROAD   JUNAGADH   GUJARAT              07-MAY-11                                                                                                                                                                                                                                                                                                                                                                                                                                                                                                                                             

SQL> UPDATE BANK_BRANCH SET BRANCH_STATE='DELHI' WHERE BRANCH_NAME='BOI';

1 row updated.

SQL> SELECT * FROM BANK_BRANCH;

BRANCH BRANCH_NAM BRANCH_ADDRESS  BRANCH_CIT BRANCH_STATE         BRANCH_OP                                                                                                                                                                                                                                                                                                                                                                                                                                                                                                                                             
------ ---------- --------------- ---------- -------------------- ---------                                                                                                                                                                                                                                                                                                                                                                                                                                                                                                                                             
B001   BOI        JAGNATH ROAD    RAJKOT     DELHI                22-MAR-15                                                                                                                                                                                                                                                                                                                                                                                                                                                                                                                                             
B002   SBI        BORIWALI ROAD   MUMBAI     MAHARASHTRA          12-JAN-00                                                                                                                                                                                                                                                                                                                                                                                                                                                                                                                                             
B003   UNION      AGRA ROAD       AGRA       U.P                  04-FEB-98                                                                                                                                                                                                                                                                                                                                                                                                                                                                                                                                             
B004   DENA BANK  C G ROAD        AHEMDABAD  GUJARAT              20-SEP-12                                                                                                                                                                                                                                                                                                                                                                                                                                                                                                                                             
B005   ICICI      MAJAVADI ROAD   JUNAGADH   GUJARAT              07-MAY-11                                                                                                                                                                                                                                                                                                                                                                                                                                                                                                                                             

SQL> COMMIT;

Commit complete.

SQL> UPDATE BANK_BRANCH SET BRANCH_OPEN_DATE='04-NOV-2015' WHERE BRANCH_NAME='UNION';

1 row updated.

SQL> SELECT * FROM BANK_BRANCH;

BRANCH BRANCH_NAM BRANCH_ADDRESS  BRANCH_CIT BRANCH_STATE         BRANCH_OP                                                                                                                                                                                                                                                                                                                                                                                                                                                                                                                                             
------ ---------- --------------- ---------- -------------------- ---------                                                                                                                                                                                                                                                                                                                                                                                                                                                                                                                                             
B001   BOI        JAGNATH ROAD    RAJKOT     DELHI                22-MAR-15                                                                                                                                                                                                                                                                                                                                                                                                                                                                                                                                             
B002   SBI        BORIWALI ROAD   MUMBAI     MAHARASHTRA          12-JAN-00                                                                                                                                                                                                                                                                                                                                                                                                                                                                                                                                             
B003   UNION      AGRA ROAD       AGRA       U.P                  04-NOV-15                                                                                                                                                                                                                                                                                                                                                                                                                                                                                                                                             
B004   DENA BANK  C G ROAD        AHEMDABAD  GUJARAT              20-SEP-12                                                                                                                                                                                                                                                                                                                                                                                                                                                                                                                                             
B005   ICICI      MAJAVADI ROAD   JUNAGADH   GUJARAT              07-MAY-11                                                                                                                                                                                                                                                                                                                                                                                                                                                                                                                                             

SQL> ALTER TABLE BANK_BRANCH ADD PINCODE NUMBER(10);

Table altered.

SQL> INSERT INTO BANK_BRANCH VALUES PINCODE='360006' WHERE BRANCH_NAME='DENA BANK';
INSERT INTO BANK_BRANCH VALUES PINCODE='360006' WHERE BRANCH_NAME='DENA BANK'
                                      *
ERROR at line 1:
ORA-00933: SQL command not properly ended 


SQL> UPDATE BANK_BRANCH
  2  SET PINCODE = '360006'
  3  WHERE BRANCH_NAME = 'DENA BANK';

1 row updated.

SQL> DELETE FROM BANK_BRANCH WHERE BRANCH_OPEN_DATE='07-MAY-2011';

1 row deleted.

SQL> SELECT * FROM BANK_BRANCH;

BRANCH BRANCH_NAM BRANCH_ADDRESS  BRANCH_CIT BRANCH_STATE         BRANCH_OP    PINCODE                                                                                                                                                                                                                                                                                                                                                                                                                                                                                                                                  
------ ---------- --------------- ---------- -------------------- --------- ----------                                                                                                                                                                                                                                                                                                                                                                                                                                                                                                                                  
B001   BOI        JAGNATH ROAD    RAJKOT     DELHI                22-MAR-15                                                                                                                                                                                                                                                                                                                                                                                                                                                                                                                                             
B002   SBI        BORIWALI ROAD   MUMBAI     MAHARASHTRA          12-JAN-00                                                                                                                                                                                                                                                                                                                                                                                                                                                                                                                                             
B003   UNION      AGRA ROAD       AGRA       U.P                  04-NOV-15                                                                                                                                                                                                                                                                                                                                                                                                                                                                                                                                             
B004   DENA BANK  C G ROAD        AHEMDABAD  GUJARAT              20-SEP-12     360006                                                                                                                                                                                                                                                                                                                                                                                                                                                                                                                                  

SQL> RENAME BANK_BRANCH TO BRANCH_MASTER;

Table renamed.

SQL> DESC BRANCH_MASTER;
 Name                                                                                                                                                                                                                                                                                                                                                              Null?    Type
 ----------------------------------------------------------------------------------------------------------------------------------------------------------------------------------------------------------------------------------------------------------------------------------------------------------------------------------------------------------------- -------- --------------------------------------------------------------------------------------------------------------------------------------------------------------------------------------------------------------------------------------------
 BRANCH_ID                                                                                                                                                                                                                                                                                                                                                                  CHAR(6)
 BRANCH_NAME                                                                                                                                                                                                                                                                                                                                                                VARCHAR2(10)
 BRANCH_ADDRESS                                                                                                                                                                                                                                                                                                                                                             VARCHAR2(15)
 BRANCH_CITY                                                                                                                                                                                                                                                                                                                                                                VARCHAR2(10)
 BRANCH_STATE                                                                                                                                                                                                                                                                                                                                                               VARCHAR2(20)
 BRANCH_OPEN_DATE                                                                                                                                                                                                                                                                                                                                                           DATE
 PINCODE                                                                                                                                                                                                                                                                                                                                                                    NUMBER(10)

SQL> SPOOL OFF;
